{
  "$schema": "http://json-schema.org/draft-07/schema#",
  "title": "Discord Messages",
  "description": "Schema for Discord message data with encrypted content",
  "type": "array",
  "items": {
    "type": "object",
    "properties": {
      "id": {
        "type": "string",
        "description": "Unique identifier for the message"
      },
      "content": {
        "type": "string",
        "description": "The message content",
        "$allot": "private"
      },
      "authorId": {
        "type": "string",
        "description": "Unique identifier for the message author",
        "$allot": "private"
      },
      "authorUsername": {
        "type": "string",
        "description": "Username of the message author",
        "$allot": "private"
      },
      "channelId": {
        "type": "string",
        "description": "Unique identifier for the channel"
      },
      "channelName": {
        "type": "string",
        "description": "Name of the channel",
        "$allot": "private"
      },
      "timestamp": {
        "type": "string",
        "format": "date-time",
        "description": "Timestamp when the message was sent"
      },
      "editedTimestamp": {
        "type": ["string", "null"],
        "format": "date-time",
        "description": "Timestamp when the message was last edited, if applicable"
      },
      "attachments": {
        "type": "array",
        "items": {
          "type": "object",
          "$allot": "private"
        }
      },
      "embeds": {
        "type": "array",
        "items": {
          "type": "object",
          "$allot": "private"
        }
      },
      "reactions": {
        "type": "array",
        "items": {
          "type": "object",
          "properties": {
            "emoji": {
              "type": "object",
              "properties": {
                "name": {
                  "type": "string",
                  "$allot": "private"
                },
                "id": {
                  "type": ["string", "null"]
                },
                "animated": {
                  "type": "boolean"
                }
              },
              "required": ["name", "id", "animated"]
            },
            "count": {
              "type": "integer",
              "minimum": 0
            },
            "users": {
              "type": "array",
              "items": {
                "type": "object",
                "properties": {
                  "userId": {
                    "type": "string",
                    "$allot": "private"
                  },
                  "username": {
                    "type": "string",
                    "$allot": "private"
                  }
                },
                "required": ["userId", "username"]
              }
            }
          },
          "required": ["emoji", "count", "users"]
        }
      }
    },
    "required": [
      "id",
      "content",
      "authorId",
      "authorUsername",
      "channelId",
      "channelName",
      "timestamp",
      "editedTimestamp",
      "attachments",
      "embeds",
      "reactions"
    ]
  }
} 